{
  "schema_version": "1.0",
  "metadata": {
    "run_id": "20260724214716-cb5efd",
    "title": "ドル円3–5年シナリオ：金利差縮小が円高方向、ただし高ボラティリティ継続",
    "generated_at": "2026-07-25T07:05:00+09:00",
    "as_of": "2026-07-25",
    "coverage": {
      "regions": [
        "日本",
        "米国",
        "グローバル"
      ],
      "sectors": [
        "外国為替",
        "金融",
        "輸出入",
        "クロスセクター"
      ],
      "horizon": "3–5年（2026年7月25日から2031年7月24日まで）",
      "spot_reference": "2026年7月24日17時の日本銀行公表値 1ドル=163.76–163.78円",
      "data_cutoff": "2026-07-25"
    },
    "decision": [
      "strategy",
      "investment",
      "business"
    ]
  },
  "executive": {
    "one_line": "短期はドル高・円安圧力が残る一方、3–5年の中心シナリオは日米金利差縮小による緩やかな円高であり、単一水準ではなく115–210円超までの条件付きシナリオで意思決定する。",
    "decision": "現在の163円台を起点に一方向へ賭けず、外貨資産・輸入原価・輸出売上を3–6か月単位で段階ヘッジする。中心ケースでは2029–2031年に135–155円を想定するが、米インフレ粘着なら160–185円、日本固有の信認ショックなら180–210円超、世界景気後退なら115–140円を許容帯とする。",
    "confidence": 0.6,
    "why_now": [
      "2026年7月24日のドル円は163.76–163.78円と、円安リスクが事業予算・外貨資産評価に直結する水準にある。",
      "日銀は政策金利を1.0%程度へ引き上げ、見通し実現時の追加利上げを示す一方、FRBは3.50–3.75%を維持している。名目政策金利差は計算上なお約2.6ポイントあり、方向転換と残存キャリーが同時に存在する。",
      "米国の2026年5月コアPCEは前年比3.4%、日本の同月コアCPIは1.4%で、急速な金利差解消を前提にできない。",
      "日本は大幅な経常黒字と対外純資産を持つが、黒字の中心は第一次所得であり、直ちに円買いへ転換されるとは限らない。"
    ],
    "watchouts": [
      "ドル円の点予測は低信頼。確率・レンジ・トリガーで管理する。",
      "介入は短期の経路を変え得るが、金利差やインフレ差を単独で反転させるとは限らない。",
      "原油・中東情勢、米国の供給ショック、日本の財政信認は、金利差だけでは説明できない非線形リスクである。",
      "本分析は投資収益を保証せず、個別銘柄のバリュエーション、税務、規制適合性を評価していない。"
    ],
    "decision_spine": [
      {
        "step": "現状",
        "claim": "ドル円163円台、FRB 3.50–3.75%、日銀1.0%程度。",
        "evidence_ids": [
          "e1-boj-fx-july24",
          "e2-boj-june-policy",
          "e3-fed-june-statement"
        ]
      },
      {
        "step": "主要因",
        "claim": "今後の日米実質・名目金利差、インフレ収束速度、原油、リスク選好。",
        "evidence_ids": [
          "e2-boj-june-policy",
          "e3-fed-june-statement",
          "e4-fed-june-sep",
          "e9-us-pce-may"
        ]
      },
      {
        "step": "中心仮説",
        "claim": "FRBの緩やかな利下げと日銀の緩やかな正常化で金利差が縮小し、円は3–5年で段階的に戻す。",
        "evidence_ids": [
          "e2-boj-june-policy",
          "e4-fed-june-sep",
          "e11-imf-japan-2026"
        ]
      },
      {
        "step": "反証条件",
        "claim": "米コアインフレ再加速、日銀の正常化停止、日本の財政・JGB市場ストレス、恒常的な資本流出。",
        "evidence_ids": [
          "e4-fed-june-sep",
          "e9-us-pce-may",
          "e11-imf-japan-2026"
        ]
      },
      {
        "step": "行動",
        "claim": "為替水準を当てに行くのではなく、予算レート帯と期限別のヘッジ比率をあらかじめ決める。",
        "evidence_ids": [
          "e1-boj-fx-july24",
          "e4-fed-june-sep"
        ]
      }
    ]
  },
  "megatrends": [
    {
      "id": "m1-policy-convergence",
      "name": "日米金融政策の非対称な正常化",
      "title": "日米金融政策の非対称な正常化",
      "stage": "scaling",
      "horizon": "1–5年",
      "velocity": 0.62,
      "impact": 0.92,
      "confidence": 0.78,
      "description": "日銀は1.0%程度まで政策金利を引き上げ、FRBは3.50–3.75%を維持している。方向は金利差縮小寄りだが、米インフレの粘着性により速度は遅い可能性が高い。",
      "drivers": [
        "米国インフレ",
        "日本の基調インフレ",
        "賃金・価格循環",
        "FRB・日銀の反応関数"
      ],
      "implications": [
        "短期のドルキャリーは残る",
        "中期の円高テールが拡大",
        "政策会合ごとのボラティリティ上昇"
      ],
      "evidence_ids": [
        "e2-boj-june-policy",
        "e3-fed-june-statement",
        "e4-fed-june-sep",
        "e8-japan-cpi-may",
        "e9-us-pce-may"
      ]
    },
    {
      "id": "m2-external-balance",
      "name": "日本の対外所得国化",
      "title": "日本の対外所得国化",
      "stage": "mature",
      "horizon": "3–10年",
      "velocity": 0.38,
      "impact": 0.66,
      "confidence": 0.82,
      "description": "日本は大きな経常黒字と対外純資産を持つ。ただし経常黒字は第一次所得に大きく依存し、海外再投資されればスポットの円買い需要は弱い。",
      "drivers": [
        "第一次所得収支",
        "海外直接投資",
        "機関投資家のヘッジ比率",
        "企業の利益還流"
      ],
      "implications": [
        "危機時の還流余地",
        "通常時は円高への機械的伝達が弱い",
        "為替変動による資産評価効果"
      ],
      "evidence_ids": [
        "e6-japan-bop-may",
        "e7-japan-iip-2025",
        "e11-imf-japan-2026"
      ]
    },
    {
      "id": "m3-energy-geopolitics",
      "name": "エネルギー・地政学ショックの常態化",
      "title": "エネルギー・地政学ショックの常態化",
      "stage": "accelerating",
      "horizon": "0–5年",
      "velocity": 0.86,
      "impact": 0.82,
      "confidence": 0.67,
      "description": "輸入エネルギー価格は日本の交易条件と円需要を悪化させ、同時に米国インフレを通じてFRBの利下げを遅らせ得る。円に二重の下押し圧力となる。",
      "drivers": [
        "原油・LNG価格",
        "中東情勢",
        "海上輸送",
        "供給制約"
      ],
      "implications": [
        "円安と輸入インフレの同時進行",
        "ヘッジコスト上昇",
        "政策反応の不確実性"
      ],
      "evidence_ids": [
        "e2-boj-june-policy",
        "e3-fed-june-statement",
        "e10-us-cpi-june"
      ]
    },
    {
      "id": "m4-us-productivity-capex",
      "name": "米国のAI投資・資本吸引力",
      "title": "米国のAI投資・資本吸引力",
      "stage": "scaling",
      "horizon": "3–7年",
      "velocity": 0.81,
      "impact": 0.63,
      "confidence": 0.54,
      "description": "AI関連投資が米国の成長期待と資本流入を支える場合、政策金利差が縮小してもドルの構造的需要が残る。日銀も世界のAI需要をリスク要因として挙げているが、為替への寄与量は未確定である。",
      "drivers": [
        "AI設備投資",
        "米国生産性",
        "株式資金流入",
        "データセンター投資"
      ],
      "implications": [
        "金利差モデルだけではドルを過小評価",
        "米株とドルの共振",
        "テック投資減速時の巻き戻し"
      ],
      "evidence_ids": [
        "e2-boj-june-policy",
        "e3-fed-june-statement"
      ]
    },
    {
      "id": "m5-japan-fiscal-aging",
      "name": "日本の高齢化・財政制約と金利上昇",
      "title": "日本の高齢化・財政制約と金利上昇",
      "stage": "structural",
      "horizon": "5–15年",
      "velocity": 0.42,
      "impact": 0.78,
      "confidence": 0.72,
      "description": "利上げは円を支え得る一方、国債費と財政持続性への懸念を強める。正常化が円高ではなくリスクプレミアム上昇につながる非線形な尾部がある。",
      "drivers": [
        "債務残高",
        "利払い費",
        "高齢化",
        "国債市場流動性"
      ],
      "implications": [
        "日銀の利上げ余地を制約",
        "JGBと円の同時下落テール",
        "財政ルールの信頼性が重要"
      ],
      "evidence_ids": [
        "e11-imf-japan-2026"
      ]
    }
  ],
  "knowledge_graph": {
    "nodes": [
      {
        "id": "n-usdjpy",
        "label": "USD/JPY",
        "type": "sector",
        "state": "163.76–163.78円（2026-07-24 17時）",
        "confidence": 0.99,
        "evidence_ids": [
          "e1-boj-fx-july24"
        ]
      },
      {
        "id": "n-fed-rate",
        "label": "FRB政策金利",
        "type": "policy",
        "state": "3.50–3.75%",
        "confidence": 0.99,
        "evidence_ids": [
          "e3-fed-june-statement"
        ]
      },
      {
        "id": "n-boj-rate",
        "label": "日銀政策金利",
        "type": "policy",
        "state": "1.0%程度",
        "confidence": 0.99,
        "evidence_ids": [
          "e2-boj-june-policy"
        ]
      },
      {
        "id": "n-rate-gap",
        "label": "日米政策金利差",
        "type": "driver",
        "state": "約2.6ポイント（計算値）",
        "confidence": 0.95,
        "evidence_ids": [
          "e2-boj-june-policy",
          "e3-fed-june-statement"
        ]
      },
      {
        "id": "n-us-inflation",
        "label": "米国インフレ",
        "type": "driver",
        "state": "コアPCE 3.4%",
        "confidence": 0.97,
        "evidence_ids": [
          "e9-us-pce-may",
          "e10-us-cpi-june"
        ]
      },
      {
        "id": "n-jp-inflation",
        "label": "日本インフレ",
        "type": "driver",
        "state": "コアCPI 1.4%",
        "confidence": 0.97,
        "evidence_ids": [
          "e8-japan-cpi-may"
        ]
      },
      {
        "id": "n-carry",
        "label": "ドルキャリー需要",
        "type": "driver",
        "confidence": 0.68,
        "evidence_ids": [
          "e2-boj-june-policy",
          "e3-fed-june-statement"
        ]
      },
      {
        "id": "n-riskoff",
        "label": "グローバル・リスクオフ",
        "type": "risk",
        "confidence": 0.62,
        "evidence_ids": [
          "e4-fed-june-sep",
          "e7-japan-iip-2025"
        ]
      },
      {
        "id": "n-oil",
        "label": "原油・エネルギー",
        "type": "risk",
        "confidence": 0.73,
        "evidence_ids": [
          "e2-boj-june-policy",
          "e3-fed-june-statement",
          "e10-us-cpi-june"
        ]
      },
      {
        "id": "n-ca",
        "label": "日本の経常収支",
        "type": "driver",
        "state": "2026年5月 +3.9683兆円",
        "confidence": 0.98,
        "evidence_ids": [
          "e6-japan-bop-may"
        ]
      },
      {
        "id": "n-primary-income",
        "label": "第一次所得",
        "type": "driver",
        "state": "2026年5月 +4.2756兆円",
        "confidence": 0.98,
        "evidence_ids": [
          "e6-japan-bop-may"
        ]
      },
      {
        "id": "n-niip",
        "label": "日本の対外純資産",
        "type": "driver",
        "state": "2025年末 +561.750兆円",
        "confidence": 0.98,
        "evidence_ids": [
          "e7-japan-iip-2025"
        ]
      },
      {
        "id": "n-repatriation",
        "label": "資金還流・ヘッジ比率",
        "type": "driver",
        "confidence": 0.55,
        "evidence_ids": [
          "e6-japan-bop-may",
          "e7-japan-iip-2025"
        ]
      },
      {
        "id": "n-intervention",
        "label": "財務省の円買い介入",
        "type": "policy",
        "state": "2026-05-28〜06-26は0円",
        "confidence": 0.92,
        "evidence_ids": [
          "e5-mof-intervention-june"
        ]
      },
      {
        "id": "n-us-capital",
        "label": "米国への資本流入",
        "type": "driver",
        "confidence": 0.54,
        "evidence_ids": [
          "e2-boj-june-policy"
        ]
      },
      {
        "id": "n-jp-fiscal",
        "label": "日本の財政信認",
        "type": "risk",
        "confidence": 0.7,
        "evidence_ids": [
          "e11-imf-japan-2026"
        ]
      },
      {
        "id": "n-volatility",
        "label": "為替ボラティリティ",
        "type": "risk",
        "confidence": 0.65,
        "evidence_ids": [
          "e4-fed-june-sep",
          "e5-mof-intervention-june"
        ]
      }
    ],
    "edges": [
      {